{
  "registrySchema": 1,
  "environment": "production",
  "generatedAt": "2026-10-25T08:00:30Z",
  "registrySequence": 4173,
  "ttlSeconds": 300,
  "killSwitch": {
    "global": false,
    "modules": []
  },
  "remotes": {
    "MOD-CAND": {
      "manifestSchema": 1,
      "moduleId": "MOD-CAND",
      "remoteName": "mf_candidate",
      "version": "1.4.2",
      "buildId": "20261020T101500Z-6fb4f7d83",
      "channel": "stable",
      "status": "active",
      "sequence": 40,
      "issuedAt": "2026-10-21T08:00:00Z",
      "notAfter": "2026-11-20T08:00:00Z",
      "minShell": "1.0.0",
      "entry": {
        "manifestUrl": "/mf/mf-candidate/1.4.2/mf-manifest.json",
        "remoteEntryUrl": "/mf/mf-candidate/1.4.2/remoteEntry.js",
        "publicPath": "/mf/mf-candidate/1.4.2/"
      },
      "hostContract": "^1.0.0",
      "apiRange": {
        "basePath": "/api/v1",
        "openapi": ">=1.0.0 <2.0.0"
      },
      "dataSchema": {
        "localSchemaMin": 1,
        "localSchemaMax": 2,
        "opSchemas": [
          {
            "opType": "profile.patch",
            "version": 1
          },
          {
            "opType": "note.put",
            "version": 1
          }
        ]
      },
      "shared": [
        {
          "name": "react",
          "singleton": true,
          "requiredVersion": "^19.0.0",
          "strictVersion": true,
          "import": false
        },
        {
          "name": "react-dom",
          "singleton": true,
          "requiredVersion": "^19.0.0",
          "strictVersion": true,
          "import": false
        },
        {
          "name": "react-router",
          "singleton": true,
          "requiredVersion": "^7.0.0",
          "strictVersion": true,
          "import": false
        },
        {
          "name": "@tanstack/react-query",
          "singleton": true,
          "requiredVersion": "^5.0.0",
          "strictVersion": true,
          "import": false
        },
        {
          "name": "@ts/ui",
          "singleton": true,
          "requiredVersion": "^1.0.0",
          "strictVersion": false,
          "import": false
        },
        {
          "name": "@ts/host-sdk",
          "singleton": true,
          "requiredVersion": "^1.0.0",
          "strictVersion": true,
          "import": false
        }
      ],
      "exposes": [
        {
          "name": "./module",
          "kind": "module",
          "contract": "@ts/host-sdk#RemoteModule@1"
        },
        {
          "name": "./testkit",
          "kind": "testkit"
        }
      ],
      "routes": [
        "/me"
      ],
      "assets": [
        {
          "path": "/mf/mf-candidate/1.4.2/remoteEntry.js",
          "type": "js",
          "integrity": "sha384-l9z+1wgQ15xnh5Wc8aYxSHOb94u2IDHBGOc50DijBf5L6dwrupY3A4cyycFl68Il",
          "size": 9216,
          "critical": true,
          "preload": true
        },
        {
          "path": "/mf/mf-candidate/1.4.2/assets/main-4f2a9c1e.js",
          "type": "js",
          "integrity": "sha384-QQPgDe0567uTMccvQI3qXabIU5bqCey/l8KRKKU+zGOunt4Zl92ARZTce9TiWYQr",
          "size": 98304,
          "critical": true,
          "preload": false
        },
        {
          "path": "/mf/mf-candidate/1.4.2/assets/main-7b1d3e5a.css",
          "type": "css",
          "integrity": "sha384-6Tb0Hv/1B/wbEyvh4iUiGoaRFEPgE2qtH97UsvIydLYrxnQgaQ/DBEPRFjq9A+o/",
          "size": 14336,
          "critical": false,
          "preload": false
        },
        {
          "path": "/mf/mf-candidate/1.4.2/mf-manifest.json",
          "type": "json",
          "integrity": "sha384-MamhrMOfFDyyNNiMxPa4HlVnCoIM0j81VkBNfrk0/9AeaPAU8sAD4dTydtK8kRdq",
          "size": 2048,
          "critical": true,
          "preload": false
        }
      ],
      "integrity": {
        "algorithm": "sha384",
        "manifest": "sha384-MamhrMOfFDyyNNiMxPa4HlVnCoIM0j81VkBNfrk0/9AeaPAU8sAD4dTydtK8kRdq",
        "remoteEntry": "sha384-l9z+1wgQ15xnh5Wc8aYxSHOb94u2IDHBGOc50DijBf5L6dwrupY3A4cyycFl68Il",
        "assetsDigest": "sha384-nx2lQGwT6XGYgIa+12G8bp27LsWiQ9WmGD84f3RiuGZuhUIlYYcZgR9S6FwwXHF6"
      },
      "healthcheck": {
        "url": "/mf/mf-candidate/1.4.2/health.json",
        "expectStatus": 200,
        "timeoutMs": 3000,
        "intervalSec": 60,
        "probe": "contract-smoke",
        "expectBuildId": true
      },
      "rollbackTo": {
        "version": "1.4.1",
        "sequence": 39,
        "entryUrl": "/mf/registry/entries/mf-candidate-1.4.1.json",
        "entryIntegrity": "sha384-okKkLYrJBwe+/Uy24U1THVf1hpzh1HnZI3UprgRFD1z5dvXPAiNUIyvy5orI8jep",
        "reason": "previous stable release"
      },
      "queueableOps": [
        {
          "opType": "profile.patch",
          "method": "PATCH",
          "pathTemplate": "/api/v1/profile",
          "maxBodyBytes": 65536
        },
        {
          "opType": "note.put",
          "method": "PUT",
          "pathTemplate": "/api/v1/notes/{noteId}",
          "maxBodyBytes": 65536
        }
      ],
      "capabilities": [
        "candidate.profile",
        "candidate.evidence"
      ],
      "events": {
        "publishes": [
          "profile.updated@1",
          "evidence.changed@1"
        ],
        "subscribes": [
          "session.changed@1",
          "sync.item-resolved@1"
        ]
      },
      "flags": [
        "cand.evidence_ladder_v2"
      ],
      "telemetry": {
        "serviceName": "ts-web-candidate",
        "sampleRate": 0.1
      },
      "bundledFallback": true,
      "owner": {
        "team": "Candidate Experience",
        "escalation": "fe-candidate"
      },
      "signature": {
        "alg": "Ed25519",
        "keyId": "ts-registry-2026-a",
        "canonicalization": "RFC8785-JCS",
        "value": "P-JXhXb-Onqe3hJiF8GpuKAq_68_EU--1i78AHqG_hTx2fIxJqVlZlkBLo53p2vFTb7kXzD2J5VeMH44zcFfBA"
      }
    },
    "MOD-LRN": {
      "manifestSchema": 1,
      "moduleId": "MOD-LRN",
      "remoteName": "mf_learning",
      "version": "1.3.0",
      "buildId": "20261020T101500Z-dc4109814",
      "channel": "stable",
      "status": "active",
      "sequence": 41,
      "issuedAt": "2026-10-21T08:00:00Z",
      "notAfter": "2026-11-20T08:00:00Z",
      "minShell": "1.0.0",
      "entry": {
        "manifestUrl": "/mf/mf-learning/1.3.0/mf-manifest.json",
        "remoteEntryUrl": "/mf/mf-learning/1.3.0/remoteEntry.js",
        "publicPath": "/mf/mf-learning/1.3.0/"
      },
      "hostContract": "^1.0.0",
      "apiRange": {
        "basePath": "/api/v1",
        "openapi": ">=1.0.0 <2.0.0"
      },
      "dataSchema": {
        "localSchemaMin": 1,
        "localSchemaMax": 2,
        "opSchemas": []
      },
      "shared": [
        {
          "name": "react",
          "singleton": true,
          "requiredVersion": "^19.0.0",
          "strictVersion": true,
          "import": false
        },
        {
          "name": "react-dom",
          "singleton": true,
          "requiredVersion": "^19.0.0",
          "strictVersion": true,
          "import": false
        },
        {
          "name": "react-router",
          "singleton": true,
          "requiredVersion": "^7.0.0",
          "strictVersion": true,
          "import": false
        },
        {
          "name": "@tanstack/react-query",
          "singleton": true,
          "requiredVersion": "^5.0.0",
          "strictVersion": true,
          "import": false
        },
        {
          "name": "@ts/ui",
          "singleton": true,
          "requiredVersion": "^1.0.0",
          "strictVersion": false,
          "import": false
        },
        {
          "name": "@ts/host-sdk",
          "singleton": true,
          "requiredVersion": "^1.0.0",
          "strictVersion": true,
          "import": false
        }
      ],
      "exposes": [
        {
          "name": "./module",
          "kind": "module",
          "contract": "@ts/host-sdk#RemoteModule@1"
        },
        {
          "name": "./testkit",
          "kind": "testkit"
        }
      ],
      "routes": [
        "/learn"
      ],
      "assets": [
        {
          "path": "/mf/mf-learning/1.3.0/remoteEntry.js",
          "type": "js",
          "integrity": "sha384-LdKn8693HRwMXdmI35XCt/vdQuOOJ2JAP8CyBrWAqTd3LwxwouPBuQLIdmnM4CV/",
          "size": 9216,
          "critical": true,
          "preload": true
        },
        {
          "path": "/mf/mf-learning/1.3.0/assets/main-4f2a9c1e.js",
          "type": "js",
          "integrity": "sha384-H58xQf6YDHt2TjPfWxxOYoefnZGQ8mcF8JMYvahjOLYaISCIWatJY+vEdi5JHByk",
          "size": 98304,
          "critical": true,
          "preload": false
        },
        {
          "path": "/mf/mf-learning/1.3.0/assets/main-7b1d3e5a.css",
          "type": "css",
          "integrity": "sha384-I/xzwsBPmddn0GwcfiDIXNRN7Nfzvs9dTzbHmPFsF4ndH7eH/AWAHxVP6PK7h8ge",
          "size": 14336,
          "critical": false,
          "preload": false
        },
        {
          "path": "/mf/mf-learning/1.3.0/mf-manifest.json",
          "type": "json",
          "integrity": "sha384-2E8553ozvcuEHBdcIFmPYKUsb57kIwdpHkPiPLyy7Zf2mBQMFmJW2IwK3JaafAJq",
          "size": 2048,
          "critical": true,
          "preload": false
        }
      ],
      "integrity": {
        "algorithm": "sha384",
        "manifest": "sha384-2E8553ozvcuEHBdcIFmPYKUsb57kIwdpHkPiPLyy7Zf2mBQMFmJW2IwK3JaafAJq",
        "remoteEntry": "sha384-LdKn8693HRwMXdmI35XCt/vdQuOOJ2JAP8CyBrWAqTd3LwxwouPBuQLIdmnM4CV/",
        "assetsDigest": "sha384-udn19Lh/ZaC3y8h4mkk3SCoT857AqzEoXfG+q7yXLaHibFQiQexb4xy8ISAtTXKk"
      },
      "healthcheck": {
        "url": "/mf/mf-learning/1.3.0/health.json",
        "expectStatus": 200,
        "timeoutMs": 3000,
        "intervalSec": 60,
        "probe": "contract-smoke",
        "expectBuildId": true
      },
      "rollbackTo": {
        "version": "1.2.5",
        "sequence": 40,
        "entryUrl": "/mf/registry/entries/mf-learning-1.2.5.json",